{
  "schema_version": "1.0.0",
  "issue_url": "https://github.com/D-sorganization/AffineDrift/issues/4062",
  "method": {
    "first_pass": "Classified route claims and compared public descriptions, chapter maps, citations, readiness language, and prerequisites with canonical manuscript inputs, the notebook bridge manifest, and separately governed software authority.",
    "second_pass": "Re-read every corrected route adversarially for causal alternatives, counterexamples, omitted chapters, mutable-source leakage, unsupported completeness, and unmeasured readiness or instructional claims."
  },
  "routes": [
    {
      "audit_id": "ad-route-b8c49a2f2553",
      "route": "/books/biomechanics-biology-to-systems.html",
      "source_path": "books/biomechanics-biology-to-systems.qmd",
      "source_sha256": "970f9f173c16cf3251ef585c0ce517d1e3a7cdf8f9ad38788d0feb8032065acf",
      "included_source_paths": [
        "articles/The_Geometry_of_Motion/Volume_III/main.tex",
        "notebooks/geometry_of_motion/manifest.json"
      ],
      "included_source_sha256": {
        "articles/The_Geometry_of_Motion/Volume_III/main.tex": "b35d1c3571fe09078dc91398ee3317e279e784d37e68e5f3175be8ba097ee506",
        "notebooks/geometry_of_motion/manifest.json": "4cc70380252c8640603cbb2b7e3f3e0d23f21ddf35ab30a8e136d035bd410b9d"
      },
      "source_revision": "d53ec669335a900fcf42bd4a6065d1d6d27046a8",
      "render_revision": "d53ec669335a900fcf42bd4a6065d1d6d27046a8",
      "reviewed_on": "2026-10-03",
      "reviewer": "codex-technical-review-4850; complete Chapter 2 and bounded landing only; earlier scientific identities and scope preserved in msk-conventions-prior-review.json; known global layout limitations remain",
      "claim_classes": ["clinical_coaching", "factual", "research_readiness"],
      "claims": [
        {
          "claim_id": "ad-book-biomechanics-evidence-readiness-001",
          "claim_classes": [
            "clinical_coaching",
            "factual",
            "research_readiness"
          ],
          "statement": "Volume III is available as provisional source material whose experimental, inverse-dynamics, muscle, tissue, clinical, and coaching interpretations remain separated by an explicit evidence ladder.",
          "publication_state": "available",
          "authority_references": [
            "articles/The_Geometry_of_Motion/Volume_III/main.tex",
            "notebooks/geometry_of_motion/manifest.json"
          ],
          "authority_limits": [
            "Manuscript availability is not empirical, clinical, diagnostic, or coaching validation.",
            "Instrumentation constrains only declared quantities and does not establish whole-model fidelity."
          ],
          "assumptions": [
            "Readers follow the declared observation-to-inference evidence ladder."
          ],
          "uncertainty": [
            "Application-specific anatomy, parameters, coordinate conventions, measurements, and validation remain outside this route audit."
          ],
          "falsifiers": [
            "A route statement describes inferred tissue or muscle quantities as directly measured without instrumentation and identification evidence."
          ],
          "audience_limits": [
            "Not clinical, diagnostic, rehabilitation, coaching, or design authority."
          ],
          "finding_id": "ad-finding-book-biomechanics-evidence-readiness"
        }
      ],
      "findings": [
        {
          "claim_ids": [],
          "critique_ids": [],
          "disposition": "corrected",
          "evidence_paths": [
            "articles/The_Geometry_of_Motion/Volume_III/main.tex",
            "books/biomechanics-biology-to-systems.qmd",
            "notebooks/geometry_of_motion/manifest.json",
            "articles/The_Geometry_of_Motion/Volume_III/chapters/ch01_biology_vs_engineering.tex",
            "articles/The_Geometry_of_Motion/Volume_III/main.pdf",
            "tests/test_biology_model_selection_rigor.py",
            "reports/technical-review/biology-model-selection-review.md",
            "reports/technical-review/biology-model-selection-render-verification.json"
          ],
          "evidence_sha256": {
            "articles/The_Geometry_of_Motion/Volume_III/chapters/ch01_biology_vs_engineering.tex": "447cfbef5d1deadc530c8a124dfcd9eaa61b74d2c6cc47f0fc7ab49e50ef2e80",
            "articles/The_Geometry_of_Motion/Volume_III/main.pdf": "2b939e306acd8429e76d5392fdd80046495179d10e5e061a9ed8bb7564c0b26e",
            "articles/The_Geometry_of_Motion/Volume_III/main.tex": "b35d1c3571fe09078dc91398ee3317e279e784d37e68e5f3175be8ba097ee506",
            "books/biomechanics-biology-to-systems.qmd": "970f9f173c16cf3251ef585c0ce517d1e3a7cdf8f9ad38788d0feb8032065acf",
            "notebooks/geometry_of_motion/manifest.json": "4cc70380252c8640603cbb2b7e3f3e0d23f21ddf35ab30a8e136d035bd410b9d",
            "reports/technical-review/biology-model-selection-render-verification.json": "e2d886062fab421ce7cce928e1903c953c27b74e8f725d9a7d25404c7224f3e9",
            "reports/technical-review/biology-model-selection-review.md": "a51ab87eae4b78d832a630837583dfd1fac61ba381512599cea140769cb5ccf2",
            "tests/test_biology_model_selection_rigor.py": "af95e3048d8cac817fbede3d9f112dc7dd0bcb7ab077580e44475d203c4f1760"
          },
          "finding_id": "ad-finding-book-biomechanics-evidence-readiness",
          "issue_url": "https://github.com/D-sorganization/AffineDrift/issues/4062",
          "priority": "p1",
          "rationale": "The prior route blurred chapter availability, notebook existence, and model fidelity; the correction pins source bytes, states scaffold limits, and bounds biological inferences. Follow-up #4463 corrects the full opening chapter and introduction, preserves notebook-scaffold limits, and binds current source/PDF and numerical/render evidence; the six scientific findings are separately recorded in biology-model-selection-dependency-carry-forward.json.",
          "verification_commit": "2be29ec3a44c3c72272458e4e04a0e767d5471d8"
        },
        {
          "claim_ids": [],
          "critique_ids": [],
          "disposition": "corrected",
          "evidence_paths": [
            "articles/The_Geometry_of_Motion/Volume_III/chapters/ch03_muscle_models.tex",
            "articles/The_Geometry_of_Motion/Volume_III/main.pdf",
            "articles/The_Geometry_of_Motion/geometry_of_motion.bib",
            "books/biomechanics-biology-to-systems.qmd",
            "tests/test_muscle_models_review.py",
            "tests/test_muscle_model_identities.py",
            "reports/technical-review/muscle-models-review.md",
            "reports/technical-review/muscle-models-original-code-checks.json",
            "reports/technical-review/muscle-models-reference-identity-checks.json",
            "reports/technical-review/muscle-models-prior-review.json",
            "reports/technical-review/muscle-models-prior-book-review.json",
            "reports/technical-review/muscle-models-checkpoint-validation.json",
            "reports/technical-review/muscle-models-render-verification.json",
            "reports/technical-review/muscle-models-delivery-validation.json"
          ],
          "evidence_sha256": {
            "articles/The_Geometry_of_Motion/Volume_III/chapters/ch03_muscle_models.tex": "e33cf2f9dd5b975ddb84a18d0688fdb9a0fe0f0e1e9a784ca58efaf87883fbdf",
            "articles/The_Geometry_of_Motion/Volume_III/main.pdf": "2b939e306acd8429e76d5392fdd80046495179d10e5e061a9ed8bb7564c0b26e",
            "articles/The_Geometry_of_Motion/geometry_of_motion.bib": "22289f1a49aaef1ef617bb657a5644aebf0e7b2a007df92cfdf177905b938d88",
            "books/biomechanics-biology-to-systems.qmd": "970f9f173c16cf3251ef585c0ce517d1e3a7cdf8f9ad38788d0feb8032065acf",
            "tests/test_muscle_models_review.py": "2404f095c8e252be6555c284bda401ec8fb9b5fc9a0f04bbc883fef41a1456b6",
            "tests/test_muscle_model_identities.py": "3d697b5e00e231f124ff3457fdb856cfbe0a69f7499a1f11ad4319afebadf6ff",
            "reports/technical-review/muscle-models-review.md": "2e39622da5ecd9828242b9b83846621ac0254bf116461ebee9aad8c790a984cc",
            "reports/technical-review/muscle-models-original-code-checks.json": "895cbab3a76781b7b65bf620003b4c3d69efbe8933a0d90b3514b4df4530563d",
            "reports/technical-review/muscle-models-reference-identity-checks.json": "07df77cefdfee4683cca3bf8f8d46a5850ef0ecd80a5393c13d0b0238f2e5e6c",
            "reports/technical-review/muscle-models-prior-review.json": "b63875e525764572cb7c520369c554aa99c3d7e5ca23df90565f35568fb8087b",
            "reports/technical-review/muscle-models-prior-book-review.json": "272e502cf2a55f1718e09765f8320b1f2403f2cc51323d267ff7a0371831e216",
            "reports/technical-review/muscle-models-checkpoint-validation.json": "f6e7ea10bf117ab65807b8a59cbabcd4c8a0f82c7087b4fcfc474ab6bfe5cbeb",
            "reports/technical-review/muscle-models-render-verification.json": "5a0d5ef6d4a0d00b24224754d12b109e59ee256eb0db485c12f756ce626d850b",
            "reports/technical-review/muscle-models-delivery-validation.json": "9f4d2e42c4610a77affa72946c62f489caaf0ddf20b883ab6789adbe6fc26d9f"
          },
          "finding_id": "ad-finding-book-muscle-models-gaussian-active-force-length",
          "issue_url": "https://github.com/D-sorganization/AffineDrift/issues/4743",
          "priority": "p2",
          "rationale": "The Gaussian active force-length relation evaluates to 0.573753 at normalized lengths 0.5 and 1.5 rather than nearly zero, with its half-height interval of approximately (0.441505, 1.558495) representing an intrinsic curve property rather than an anatomical range.",
          "verification_commit": "46f71eda4eaf4965ffa12b5025544dce98f632b8"
        },
        {
          "claim_ids": [],
          "critique_ids": [],
          "disposition": "corrected",
          "evidence_paths": [